{
  "id": "golden-004-provider-availability-contract",
  "title": "Golden 004 provider availability contract",
  "category": "harness-contract-feature",
  "risk_level": "medium",
  "instruction": "Verify that provider availability is fail-closed and requires current live success.",
  "setup": [],
  "verifier": [
    "python3 .codex/harness/scripts/assert_golden_task.py golden-004-provider-availability-contract"
  ],
  "success_criteria": [
    "provider-availability.json uses fail-closed defaults and valid provider statuses."
  ],
  "forbidden_actions": [
    "Do not push.",
    "Do not write GitHub comments.",
    "Do not add API keys to repository files."
  ],
  "notes": "Harness contract feature task 4/10."
}
